order_id,customer_id,date,nearest_warehouse,shopping_cart,order_price,delivery_charges,customer_lat,customer_long,coupon_discount,order_total,season,is_expedited_delivery,distance_to_nearest_warehouse,latest_customer_review,is_happy_customer
ORD282379,ID0579494624,2019-12-18,Thompson,"[('Lucent 330S', 2), ('Alcon 10', 1), ('pearTV', 1)]",17720,86.57,-37.8144011,144.9493105,0,17806.57,Summer,True,0.2754,the best the best smartphone,True
ORD086546,ID2021108591,2019-05-25,Thompson,"[('Alcon 10', 2), ('iStream', 2), ('Thunder line', 2)]",22560,66.75,-37.8095146,144.9579733,10,20370.75,Autumn,False,1.0214,"lucentrola always delivers i ve had several lucentrola models but lucentrola one is really something special. it is quick, practical, easy... i believe lucentrola will be my next phone again",True
ORD457554,ID0711358362,2019-02-17,Thompson,"[('iStream', 2), ('pearTV', 1), ('Universe Note', 2), ('Olivia x460', 2)]",15960,95.27,-37.807193,144.9582795,10,14459.27,Summer,True,1.1594,great price she loved it,True
ORD279811,ID0579392156,2019-03-09,Nickolson,"[('iAssist Line', 2), ('Candle Inferno', 1), ('pearTV', 2), ('Lucent 330S', 1)]",18730,66.48,-37.8222219,144.95629169999995,25,14113.98,Autumn,True,1.2339,item not working like the item but it is not working now.,False
ORD232078,ID4740822062,2019-10-11,nickolson,"[('Alcon 10', 2), ('iStream', 1)]",18050,78.8,-37.8036557,144.94979030000005,0,18128.8,Spring,False,1.0319,phone review really good phone for the price. this phone is more than enough for an every day user.,True
ORD368622,ID2421601621,2019-05-24,Thompson,"[('Thunder line', 2), ('Olivia x460', 2), ('iStream', 2)]",7110,66.07,-37.8262873,144.95208799999997,5,6820.57,Autumn,False,1.5784,"smooth i always wanted one of these phones and now finally i got one ,love it.",True
ORD273762,ID0257505377,2019-04-13,Thompson,"[('Alcon 10', 1), ('iAssist Line', 1), ('Universe Note', 1)]",14625,85.14,-37.7989032,144.9626467,25,11053.89,Autumn,True,2.0559,awesome love it,True
ORD344183,ID0250774444,2019-12-09,Bakers,"[('Thunder line', 2), ('iStream', 2), ('pearTV', 2), ('Alcon 10', 1)]",26230,106.3,-37.8185269,145.01428059999995,25,19778.8,spring,True,1.9256,three stars ok but keys are too small,True
ORD017305,ID0052450490,2019-06-03,Thompson,"[('pearTV', 2), ('iStream', 1)]",12770,87.36,-37.7922014,144.93664209999997,5,12218.86,Winter,False,2.4565,five stars good phone,True
ORD072082,ID0373644742,07-08-2019,Thompson,"[('pearTV', 2), ('iStream', 1)]",12770,82.54,-37.8088818,144.9283336,25,9660.04,Winter,True,1.7009,"olivia g550t the olivia g550t is a good phone for the money and with the sd card, along with the internal storage, i have no lagging which is great. i'm happy with this phone.",True
ORD381297,ID0588236765,2019-12-23,Nickolson,"[('Toshika 750', 2), ('Lucent 330S', 1), ('Universe Note', 2)]",16770,73.42,-37.81143970000001,144.9732334,15,14327.92,Summer,False,0.8598,excellent product it works and performs as described. the alcon is way faster than my old alcon 6plus. although it is the exact same dimensions as the old phone. except for the camera lense on the back. otherwise an excellent product. thanks,True
ORD409582,ID6167289301,2019-07-02,Nickolson,"[('Olivia x460', 1), ('pearTV', 1)]",7535,67.94,144.9663227,-37.80872520000001,10,6849.44,Winter,False,1.1348,i 7 s plus phone looks great,True
ORD089570,ID1458418065,2019-02-23,Bakers,"[('Universe Note', 2), ('iStream', 2), ('Toshika 750', 1), ('pearTV', 1)]",17830,101.38,-37.8196578,145.0098988,15,15256.88,Summer,True,1.6794,"great value for money thought it only had face recognition, didn't know it had finger print as well.",True
ORD047471,ID0368376892,2019-01-19,Bakers,"[('iAssist Line', 2), ('Alcon 10', 2)]",22350,78.72,-37.8028956,144.9811904,15,19076.22,Summer,False,1.4662,hands free voice commands and interactions with smart devices around the house makes having an thunder plus one of the best purchases i’ve made!,True
ORD086008,ID0595868340,2019-04-29,Nickolson,"[('iAssist Line', 1), ('pearTV', 2), ('Toshika 750', 1)]",19165,49.92,-37.8118825,144.9695648,25,14423.67,Autumn,False,0.7472,will not hold signal through metropcs will not hold signal through metropcs,False
ORD335395,ID6207229686,2019-04-13,Nickolson,"[('iStream', 2), ('Universe Note', 2), ('Alcon 10', 1)]",13510,81.71,-37.8083451,144.9659842,25,10214.21,Autumn,True,1.1833,great service fast shipping exactly what i ordered super excited... love the phone,True
ORD461776,ID0581787684,2019-21-05,Thompson,"[('Alcon 10', 1), ('Lucent 330S', 2), ('Toshika 750', 1), ('Olivia x460', 2)]",18180,85.1,-37.80445200000001,144.9262237,5,17356.1,Autumn,True,2.049,five stars excellent phone! i do not understand why people are buying alcon or olivia for $$$$$!!!,True
ORD387662,ID0591317288,2019-10-15,Nickolson,"[('iStream', 2), ('Universe Note', 2), ('Thunder line', 2)]",11560,104.04,-37.8252803,144.95722450000005,25,8774.04,Spring,True,1.3651,after long review decided to buy the inferno tablet as a gift for a great frienday. she loves it! it's the perfect size and has all the features she was looking for in a tablet. happy birthday!,True
ORD170566,ID1560149571,2019-02-11,Thompson,"[('pearTV', 2), ('iAssist Line', 2)]",17070,73.15,-37.8157587,144.9372072,0,17143.15,Summer,False,1.9389,"works much better than the htc works much better than the htc, samsun, and lucentrola phones i've used. very slim and i love how toshika keeps updating and making things easier. love the toshika gallery.",True
ORD185608,ID4730421708,2019-01-01,Thompson,"[('pearTV', 2), ('Alcon 10', 1), ('Lucent 330S', 1), ('iStream', 1)]",22950,74.07,-37.8035042,144.9498163,15,19581.57,Summer,False,1.0489,worth nice and cheap. very good. if you don't wanna spend much money in a latest version this is what you need.,True
ORD211793,ID4520380532,2019-02-26,Thompson,"[('Lucent 330S', 2), ('Candle Inferno', 1), ('Toshika 750', 1), ('Universe Note', 1)]",10660,74.0,-37.8157078,144.95823090000005,15,9135.0,Summer,False,0.9473,five stars worth to spend for such beautiful phone.,True
ORD337300,ID4884440913,2019-05-06,Thompson,"[('Alcon 10', 1), ('Universe Note', 1), ('iStream', 2), ('Candle Inferno', 2)]",13560,68.18,-37.79996920000001,144.9351234,10,12272.18,Autumn,False,1.7617,i love it. it does everything.,True
ORD178405,ID0655124862,2019-09-07,thompson,"[('pearTV', 2), ('iStream', 2), ('Alcon 10', 1)]",21870,61.2,-37.807502,144.942541,25,16463.7,Spring,False,0.7,"s8 not so great fell from my couch cushion about 20-24"" to hardwood floor. in otterbox commuter case, iq shield screen protector. edge looks like i smashed it with a hammer and it sent a crack across the top. these phones are fragile. read other reviews. bixby is totally useless and annoying. avoid!",False
ORD088381,ID0363400855,2019-26-02,Thompson,"[('Lucent 330S', 2), ('Toshika 750', 2)]",11100,104.4,-37.799787,144.9621041,25,8429.4,Summer,True,1.951,universe a30 came very fast and was just like it was advertised .,True
ORD366142,ID4442480290,2019-05-31,Thompson,"[('iAssist Line', 1), ('Thunder line', 1), ('Olivia x460', 2), ('Toshika 750', 1)]",11175,81.8,144.95147980000004,-37.8254058,0,11256.8,Autumn,True,1.4695,"basic candy bar phone, worked well with t-mobile in the usa. basic candy bar phone, worked well with t-mobile in the usa.",True
ORD426757,ID0711331285,2019-07-04,Thompson,"[('Candle Inferno', 1), ('Thunder line', 1)]",2610,75.63,-37.8070369,144.9570793,0,2685.63,Winter,True,1.0811,smart phone so far so good. no problems with the product.,True
ORD184607,ID6167191746,2019-05-24,Nickolson,"[('Candle Inferno', 2), ('Alcon 10', 1)]",21570,64.6,-37.8134398,144.9740272,5,20556.1,Autumn,False,0.6959,great buy! excellent product. arrived in flawless condition and works well.,True
ORD437839,ID0767658128,2019-02-14,Nickolson,"[('Universe Note', 2), ('Candle Inferno', 1), ('iStream', 2)]",7630,78.54,-37.8067611,144.97331680000005,25,5801.04,Summer,False,1.3583,i have really enjoyed it so far. while not perfect by any means it is certainly worth the price.,True
ORD437326,ID0579999697,2019-01-30,Thompson,"[('Alcon 10', 2), ('pearTV', 2), ('iStream', 2), ('Candle Inferno', 1)]",31250,81.6,-37.805928,144.9320632,0,9907.0,Summer,False,1.5184,bought this for each of my grandchildren and they loved it. very user friendly,True
ORD258055,ID0233270841,2019-11-22,Bakers,"[('Lucent 330S', 1), ('Olivia x460', 1), ('iStream', 2), ('Universe Note', 2)]",9655,83.34,-37.7992834,144.9818062,25,7324.59,Spring,False,1.6782,came on time good so far,True
ORD009942,ID0598347140,2019-10-06,Nickolson,"[('iStream', 2), ('iAssist Line', 2)]",4750,62.35,-37.8139544,144.96358869999997,5,4574.85,Spring,False,0.736,"doesn't work the phone stopped working after a couple of days. we are trying to have it fixed or replaced, otherwise we will simply return it and buy another one.",False
ORD193463,ID0030947751,2019-11-13,Bakers,"[('Toshika 750', 2), ('iAssist Line', 1)]",10865,102.12,-37.8207972,144.9942398,25,8250.87,Spring,False,1.2055,i like that it responds every time. it was easy to set up.  i'm still learning what i can do with it. i may like a better speaker more.,True
ORD001429,ID0030942260,2019-02-07,Thompson,"[('Thunder line', 1), ('iStream', 2), ('Toshika 750', 2), ('Alcon 10', 2)]",29020,54.42,-37.8078249,144.94788490000005,10,26172.42,Summer,False,0.5444,i bought this for 3 year old to replace an older ipad. it was functional but no where near level of ipad. this is understandable based on price difference/ i returned to store.,False
ORD380025,ID0846545707,2019-09-07,Nickolson,"[('Thunder line', 2), ('Candle Inferno', 2), ('iStream', 1), ('Alcon 10', 2)]",23270,73.01,-37.8186018,144.9680187,10,21016.01,Spring,False,0.8234,great value great value phone with features i wanted. no complaints yet.,True
ORD383904,ID0233562064,2019-11-03,Nickolson,"[('Toshika 750', 2), ('Candle Inferno', 2), ('Alcon 10', 2)]",27400,70.08,-37.8033334,144.9760114,10,24730.08,Spring,True,1.7914,"not dual sim watch out i received g970f which is not dual sim. as i live in argentina, i'm not able to exchange it for the correct version. now i'm stuck with a phone i cannot use.",False
ORD006965,ID1479905301,2019-06-08,Nickolson,"[('Alcon 10', 2), ('Universe Note', 1), ('pearTV', 2), ('Candle Inferno', 2)]",9510,77.29,-37.8206978,144.9567946,0,34907.29,Winter,True,1.1459,fast response to prob this is a great phone. i had a prob with the first phone they sent me and they got back to me immediately (same day)and sent me a new phone. love my phone ty,True
ORD228391,ID2927793634,2019-02-20,Bakers,"[('Thunder line', 2), ('iStream', 2), ('pearTV', 1)]",10970,64.54,-37.8219232,144.9968175,5,10486.04,winter,False,1.335,"no return policy do not waste your money on buying this phone,it lasted a month and no return policy,very disappointing!",False
ORD442519,ID0591430026,2019-04-18,Nickolson,"[('Lucent 330S', 1), ('pearTV', 2), ('Thunder line', 2)]",18210,62.53,-37.8183458,144.96413969999998,5,17362.03,Autumn,True,0.4767,phone is static i didn’t use the phone for a day and it’s already malfunctioning,False
ORD485007,ID1479905309,2019-09-04,Thompson,"[('Alcon 10', 2), ('Olivia x460', 2)]",20350,80.46,-37.8211862,144.9554005,25,15342.96,Spring,False,1.1978,like that there are lots of apps to choose from. very user friendly,True
ORD085060,ID4297530204,2019-01-11,thompson,"[('Thunder line', 2), ('Alcon 10', 2)]",22260,100.17,-37.8055827,144.9761361,5,21247.17,Summer,True,1.56,"excellent deal! my first experience with huawei, the first of many! it reminds me of when pear first came out, it's something new and different from the same old usual.",True
ORD470581,ID0746917819,2019-05-20,Nickolson,"[('Alcon 10', 1), ('Thunder line', 2), ('Lucent 330S', 2), ('Universe Note', 2)]",22670,71.52,-37.8251508,144.9825709,10,20474.52,Autumn,False,1.3577,good all around phone nothing,False
ORD299053,ID0282825809,2019-02-17,Thompson,"[('iStream', 2), ('pearTV', 1), ('Lucent 330S', 2), ('Alcon 10', 1)]",18020,76.28,-37.8022545,144.9493479,0,7895.25,Summer,False,1.177,cheep but good very good to use only simply calling and receiving. only one concern is the back cover easily to slip out.,True
ORD236970,ID0634783034,2019-01-04,Thompson,"[('Lucent 330S', 1), ('Thunder line', 2)]",5590,71.6,-37.8127746,144.9396702,15,4823.1,Summer,False,0.6508,really satisfying i really like it,True
ORD209154,ID5797734218,2019-09-10,Thompson,"[('Alcon 10', 1), ('pearTV', 1)]",15260,100.99,-37.8036135,144.9484611,5,14597.99,Spring,True,1.0159,great service quick delivery and order received as expected.,True
ORD433789,ID1994687835,2019-01-30,Thompson,"[('iStream', 1), ('Thunder line', 1), ('pearTV', 1)]",1380,100.89,-37.7996368,144.9509081,5,8308.89,Summer,True,1.4899,how easy if was to set up.,True
ORD498413,ID3094966839,2019-02-21,Thompson,"[('Toshika 750', 2), ('pearTV', 1)]",14950,77.44,-37.8024254,144.94817869999997,5,14279.94,Summer,False,1.1449,"so far so good bought the phone for my daughter 1 month ago. i was worried about buying it online. however after a month, i can report no problems so far. battery holds a great charge, phone was new and in original packaging. i have been pretty happy so far.",True
ORD159809,ID1449285264,2019-06-09,Nickolson,"[('Toshika 750', 1), ('Universe Note', 2)]",11220,67.12,-37.8160776,144.9825965,25,8482.12,Winter,True,1.1809,five stars great phone,True
ORD042371,ID6167247298,2019-12-25,Nickolson,"[('pearTV', 1), ('Thunder line', 2), ('Olivia x460', 1), ('Toshika 750', 2)]",20675,54.58,-37.8182673,144.9642352,5,19562.83,Summer,False,0.4689,waste of money now we have to order another phone paid for faster shipping when we got it the phone doesn't work! waste of money now we have to order another phone.,False
ORD163885,ID0370242326,2019-12-18,Nickolson,"[('Alcon 10', 2), ('Universe Note', 2), ('Olivia x460', 2)]",27250,104.02,-37.7999955,144.9719925,15,23266.52,Summer,False,2.0815,phone got this phone number for my son he absolutely loves it.,True
ORD227391,ID0493053630,2019-02-25,Bakers,"[('Olivia x460', 1), ('pearTV', 2), ('iAssist Line', 2)]",18295,94.1,-37.8038474,144.9879446,25,13815.35,Summer,True,0.9377,amazing phone! the phone works like a charm!,True
ORD021471,ID4716795176,2019-02-13,Bakers,"[('Olivia x460', 2), ('Candle Inferno', 1), ('iAssist Line', 1), ('Universe Note', 1)]",8555,58.28,-37.8188818,144.9531234,25,6474.53,Summer,False,0.8724,scratched up device product has several scratches for the price.,False
ORD452493,ID4735909075,2019-01-07,Thompson,"[('iStream', 2), ('Universe Note', 2), ('Thunder line', 2), ('Lucent 330S', 2)]",14020,79.53,-37.8041573,144.9499999,5,13398.53,Summer,True,0.9824,sloooow as other stated this phone is slow and freezes up. unless she got a bad one this is a piece of junk! spend your money on a better phone.,False
ORD483514,ID3213448169,2019-10-07,Thompson,"[('pearTV', 1), ('Candle Inferno', 2)]",10760,81.44,-37.808057700000006,144.9609388,0,10841.44,Spring,False,1.3236,i like that it’s voice activated but it don’t link with any other bluetooth devices only iassist devices,True
ORD474611,ID0560997644,2019-04-23,Thompson,"[('Candle Inferno', 1), ('iAssist Line', 1)]",2655,78.89,-37.8108598,144.93843969999998,0,2733.89,Autumn,True,0.3359,"spec for price amazing phone, probably the best lucentrola phone",True
ORD199512,ID1463620801,2019-08-11,Bakers,"[('Lucent 330S', 1), ('Universe Note', 2), ('pearTV', 1), ('Candle Inferno', 1)]",14870,66.74,-37.8165173,145.00563359999995,15,12706.24,Winter,True,1.1678,"awesome a great phone, awesome screen & great pictures. battery life is great. i ordered one for my husband too & he just loves it.",True
ORD193760,ID2442297401,2019-07-16,Thompson,"[('pearTV', 2), ('iStream', 2), ('Toshika 750', 1)]",17240,63.22,-37.817114200000006,144.9531806,5,16441.22,Winter,False,0.7302,"i live alone, this is the best companion!",True
ORD346830,ID3218226979,2019-04-01,Thompson,"[('Thunder line', 1), ('iStream', 2), ('pearTV', 1), ('iAssist Line', 1)]",11015,49.68,-37.8076183,144.945192,5,10513.93,Autumn,True,0.5864,not compatible with total wireless i read a few questions that stated the phone was compatible with total wireless but i got the phone and found out that it was not. also i could not get the fingerprint scanner to work.,False
ORD007562,ID0576876684,2019-07-20,Nickolson,"[('Candle Inferno', 2), ('Lucent 330S', 1)]",2090,59.94,-37.8174345,144.97131130000002,5,2045.44,Winter,True,0.2016,poor performance this phone was the biggest piece of garbage ever. the speaker phone never worked. the reception is horrible. i don't know what is wrong with it but i've used it for a few months and it is never performed properly.,False
ORD334537,ID0227770487,2019-05-25,Bakers,"[('Olivia x460', 1), ('Alcon 10', 2), ('Toshika 750', 2)]",27765,52.99,-37.8014407,144.98510480000004,25,20876.74,Autumn,False,1.304,i dont know why it gets totally blurrex and then gose back to clesr blurred phone works sometimes blurred getting more often,False
ORD052925,ID1288940370,05-12-2019,Thompson,"[('Toshika 750', 1), ('Candle Inferno', 1), ('Olivia x460', 2), ('Thunder line', 2)]",11560,95.8,-37.8187846,144.9524658,15,9921.8,Summer,True,0.8295,"battery dies a little too fast but overall it's good for the price just what i needed,battery dies a little too fast but overall it's good for the price.",True
ORD053139,ID0248746689,2019-06-26,Bakers,"[('Lucent 330S', 2), ('Alcon 10', 1)]",11410,60.91,-37.8126546,144.9955805,10,10329.91,Winter,True,0.2975,three stars the phone it's great but came without earphone...too bad.,True
ORD366189,ID0589402277,2019-09-13,Nickolson,"[('Alcon 10', 2), ('Universe Note', 1), ('Olivia x460', 1), ('pearTV', 1)]",28885,74.51,-37.8116975,144.9704856,5,27515.26,Spring,True,0.7722,great phone for older people!! great phone for the older folks! my mom loves it!,True
ORD245256,ID0301539191,2019-10-31,Nickolson,"[('Thunder line', 2), ('Olivia x460', 2)]",6810,64.36,-37.8224476,144.9559545,10,6193.36,Spring,False,1.2702,"i'm waiting for the phone!!! months van varios meses. y no me entregan ni el celular , ni devuelven el dinero!",True
ORD244875,ID2277912673,2019-07-11,Thompson,"[('Toshika 750', 2), ('pearTV', 1), ('Lucent 330S', 2)]",17410,81.62,-37.821611,144.9362424,25,13139.12,Winter,True,1.3771,purchased two inferno8 tablets for my children. my son loves it for reading books from library and my daughter loves listening to audio books.they both were not sure they would like the tablet but they really love them.,True
ORD316924,ID0588197234,2019-05-11,Nickolson,"[('Alcon 10', 2), ('pearTV', 1), ('Candle Inferno', 1)]",24640,64.67,-37.8121007,144.9739438,0,24704.67,Autumn,False,0.8197,its basically new!!! i waited patiently and when it arrived i set it up easy!!! it came looking brand new and works like it is new i love it!!!!,True
ORD412875,ID0157850295,2019-01-03,Nickolson,"[('Lucent 330S', 2), ('Olivia x460', 1), ('pearTV', 2)]",16305,52.77,-37.8194451,144.97172709999995,10,14727.27,Summer,False,0.6742,arrived defective arrived defective. returned it. still waiting for my money back.,False
ORD231170,ID0746917992,2019-09-19,Nickolson,"[('Alcon 10', 1), ('Olivia x460', 1), ('iAssist Line', 1)]",12400,107.48,-37.8247514,144.9827077,10,11267.48,Spring,True,1.3446,"it is unlocked i was reading reviews of how it was a bad product, which made me not want to purchase from here but then it came in the mail and although it didn’t come with original box and charger the phone is perfect 10/10. so far i love it",True
ORD239119,ID0319159694,2019-06-17,Thompson,"[('iStream', 2), ('Toshika 750', 2)]",8940,66.5,-37.8101542,144.95770290000004,25,6771.5,Winter,False,0.9763,great! i'm going to buy more electronics toshika makes the best consumer electronics,True
ORD361417,ID0777841688,2019-03-31,Thompson,"[('Olivia x460', 2), ('Universe Note', 2), ('Toshika 750', 2), ('iAssist Line', 2)]",18160,82.37,-37.8018052,144.9571189,10,16426.37,Autumn,True,1.4983,great phone for price received my phone earlier than expected which was great! i have cricket service so it was easy to switch over phones! phone is in great condition no scratches screen is clear! so far so good! i would recommend this seller!,True
ORD365734,ID0222975383,2019-10-15,Bakers,"[('iAssist Line', 1), ('iStream', 2), ('pearTV', 2)]",15145,79.33,-37.8070069,144.9851467,10,13709.83,Spring,False,0.9473,great great,True
ORD151279,ID4884440882,2019-03-17,Thompson,"[('pearTV', 2), ('Lucent 330S', 1), ('iAssist Line', 1)]",16075,53.11,-37.8000152,144.935183,15,13716.86,Autumn,False,1.7545,do not buy if you have at&t!!!!! there is no data feature for at&t customers. so the phone is useless basically unless you're on wifi,False
ORD055181,ID5058108345,2019-02-07,Nickolson,"[('pearTV', 1), ('iStream', 1), ('Thunder line', 1)]",8640,91.5,-37.82350039999999,144.96901530000005,0,8731.5,Summer,True,0.5481,"i love this phone! terrrific but no all that tough, though sturdier. works so well, features great, very intuitive and get this over the overrated alcon. love it!",True
ORD403265,ID3215192027,2019-01-25,Thompson,"[('Candle Inferno', 2), ('pearTV', 1)]",27935,68.85,-37.8088693,144.9462635,25,5446.35,Summer,False,0.4293,five stars i love this phone its great,True
ORD169959,ID0579401853,2019-11-09,Nickolson,"[('Toshika 750', 1), ('Alcon 10', 1)]",13270,73.51,-37.8190779,144.97381230000005,0,13343.51,Spring,True,0.3786,refurbished my phone is refurbished and works beautifully. i have had pear alcon users tell me that the picture quality of my phone was better than their expensive pear phones. love it!,True
ORD359098,ID0054552174,2019-01-29,Nickolson,"[('Candle Inferno', 2), ('iAssist Line', 2), ('Universe Note', 2)]",12210,75.06,-37.8196791,144.9816751,0,12285.06,Summer,True,1.0729,"excellent product, i sent a device ""dual sim"" excellent product, i sent a device ""dual sim"", additional to this i found a headset that is the positive, but the negative thing is that i did not find the data cable, otherwise i am very happy with the product and service.",True
ORD310185,ID0128982298,2019-10-18,Nickolson,"[('Candle Inferno', 1), ('Olivia x460', 2), ('iAssist Line', 1), ('pearTV', 1)]",11415,75.76,-37.8172561,144.96217019999997,25,8637.01,Spring,False,0.6659,lot to learn it's nothing like it this is the best phone i have ever had it truly is awesome,True
ORD281593,ID2204643304,2019-04-17,Bakers,"[('iStream', 2), ('pearTV', 1), ('Candle Inferno', 2)]",7470,69.27,-37.8006219,144.9781021,15,6418.77,Autumn,False,1.8327,impeccable works as advertised out of the box. flawless. thank you.,True
ORD270753,ID2383211194,2019-12-20,Nickolson,"[('Alcon 10', 1), ('Toshika 750', 2), ('pearTV', 2)]",30210,76.16,-37.8095268,144.9638244,5,28775.66,Summer,False,1.1281,well it is not 100 percent new it is so nice,True
ORD403789,ID5884356154,2019-02-07,Thompson,"[('Olivia x460', 1), ('Lucent 330S', 2), ('Universe Note', 1)]",7135,87.84,-37.82494060000001,144.93296930000002,15,6152.59,Summer,True,1.8445,no support window open? useless no support window open? i just bought this phone in june and it is already useless. the touch pad is dead and the charger went out. what are you going to do for me???,False
ORD056902,ID0580321426,2019-12-28,Thompson,"[('pearTV', 1), ('Thunder line', 2), ('Alcon 10', 2)]",28570,103.92,-37.8045541,144.9277419,25,21531.42,Summer,True,1.9251,"great phone unlimited capabilities specially when you expand it with ... great phone unlimited capabilities specially when you expand it with the usb otg that allows you to be able to do so much more. when i attach the usb otg, i can expand my memory by using a regular usb thumb drive.",True
ORD207788,ID0777710193,2019-12-08,Thompson,"[('Thunder line', 2), ('Toshika 750', 1), ('Olivia x460', 2)]",11130,76.7,-37.805742,144.9552312,25,8424.2,Summer,False,1.0539,"value for money. like new as described, refurbished but like new. good support from seller",True
ORD459558,ID2632207571,2019-09-24,Nickolson,"[('Candle Inferno', 2), ('iAssist Line', 2), ('iStream', 1)]",5460,104.88,-37.8176641,144.98370219999995,15,4745.88,Spring,True,1.2487,nice phone it's good,True
ORD487037,ID0664378465,2019-10-14,bakers,"[('Lucent 330S', 1), ('iStream', 1)]",1380,97.21,-37.82012260000001,144.9669896,25,1132.21,Spring,True,0.2822,bought it on sale for christmas gift and we'll worth the money. does everything needed with good functionality. easy to use for those not too tech savvy.,True
ORD219971,ID0760183043,2019-07-11,Thompson,"[('Olivia x460', 1), ('Toshika 750', 2)]",9865,77.56,-37.820326,144.950964,5,2745.78,Winter,True,0.9182,superb phone for the price my older lucentrola e 2nd ed. could no longer handle all the apps i'd loaded so i was looking for another inexpensive replacement. this phone is more than adequate for my needs; i especially like the long lasting battery.,True
ORD080264,ID4716795160,08-08-2019,Thompson,"[('Thunder line', 1), ('Alcon 10', 1), ('Universe Note', 1), ('pearTV', 1)]",20890,76.23,-37.8188804,144.9530751,25,15743.73,Winter,True,0.8697,"works great. thinking about buying another one for my sister ordered may 17 2019, still works perfectly on verizon. everything works. i'm happy with my purchase. i'm thinking about buying one for my sister.",True
ORD370206,ID4740822036,2019-05-26,Thompson,"[('Lucent 330S', 2), ('iAssist Line', 2)]",6910,80.24,-37.80339220000001,144.9499865,0,6990.24,Autumn,False,1.0645,i like it and the storage it's a fast phone. i like it and the storage. only problem i've had is that it freezes up alot and takes a minute to restart it. other than that it's great.,True
ORD389967,ID0294624709,2019-09-14,Nickolson,"[('Olivia x460', 2), ('Candle Inferno', 1), ('Lucent 330S', 1), ('Toshika 750', 1)]",8430,58.25,-37.819261,144.9635501,0,8488.25,Spring,False,0.5329,"the whole ai question and answer dynamic is cool, but the speakers are weak. the bass is non existent and the treble is harsh.",False
