order_id,customer_id,date,nearest_warehouse,shopping_cart,order_price,delivery_charges,customer_lat,customer_long,coupon_discount,order_total,season,is_expedited_delivery,distance_to_nearest_warehouse,latest_customer_review,is_happy_customer
ORD239858,ID0247129020,2019-12-04,Nickolson,"[('iAssist Line', 1), ('Alcon 10', 1), ('iStream', 2)]",11475,96.84,-37.82626550000001,144.9784469,10,10424.34,Summer,True,1.158,"this thing is way cool!  you should get one.  if you want to be cool, that is.",True
ORD495066,ID0361269187,2019-04-02,Bakers,"[('Toshika 750', 2), ('Lucent 330S', 1)]",9870,69.28,-37.8006133,144.9773735,0,9939.28,Autumn,True,1.8863,"one star it is a scam!! i received two empty boxs with no phones inside, just accessories only.",False
ORD259702,ID1982491305,2019-04-16,Thompson,"[('Alcon 10', 2), ('Thunder line', 2), ('Toshika 750', 2)]",30900,81.73,-37.8020834,144.947903,25,23256.73,Autumn,False,1.1811,excellent excellent,True
ORD023296,ID0679680980,2019-06-23,Bakers,"[('pearTV', 1), ('Candle Inferno', 1), ('Alcon 10', 2)]",24640,82.92,-37.7995708,144.9794226,25,10552.94,Winter,True,1.8111,"five stars very good, and nothing wrong",True
ORD468482,ID2473002369,2019-12-21,Bakers,"[('Universe Note', 2), ('iAssist Line', 2), ('pearTV', 1)]",17660,94.18,-37.8041384,145.0021403,0,17754.18,Summer,False,0.8913,good balance between price and specs good balance between price and specs,True
ORD367385,ID4418536057,2019-01-06,Thompson,"[('pearTV', 1), ('Universe Note', 2), ('Lucent 330S', 2), ('iAssist Line', 1)]",17895,102.53,-37.8026029,144.9632644,25,13523.78,Summer,True,1.024,"great deal brand new basically. came in original box with original charger, etc.",True
ORD303189,ID0589488568,2019-03-20,Nickolson,"[('Toshika 750', 1), ('Universe Note', 2), ('Thunder line', 2)]",7770,65.31,-37.8202621,144.9576844,25,11750.31,Autumn,False,1.0599,perfect phone everything about this phone was perfect! i would definitely shop with this vendor again,True
ORD427825,ID2189497232,2019-03-01,Nickolson,"[('Olivia x460', 2), ('Thunder line', 1)]",4630,65.66,-37.8112629,144.97310259999998,15,4001.16,Autumn,True,0.8739,good value for money. great phone. fabulous photos. battery only lasts morning to night.,True
ORD021186,ID4698484052,2019-08-10,Bakers,"[('Alcon 10', 1), ('pearTV', 1), ('Lucent 330S', 1), ('iAssist Line', 2)]",20940,67.34,-37.8027369,145.0021591,5,19960.34,Winter,False,2.1581,"good size, and has some new built-in functions along ... as a first time universe owner, i did not know what to expect. the phone is fast, good size, and has some new built-in functions along the right edge that adds versatility.",True
ORD473059,ID0844483079,2019-04-24,Thompson,"[('iAssist Line', 2), ('Toshika 750', 1)]",8770,79.7,-37.8205129,144.9486694,0,8849.7,Autumn,True,0.884,speed is phenomenon; superb face recognition. was not disappointed at all. upgraded from a mate 20. the face recognition works perfect even in the dark. finger print requires some pressure.,True
ORD218559,ID2247182216,2019-03-13,Thompson,"[('pearTV', 2), ('Thunder line', 1), ('iAssist Line', 1), ('Olivia x460', 2)]",11400,80.17,-37.8185906,144.95574140000005,5,18581.42,Autumn,True,1.0077,perfect perfect,True
ORD215054,ID0589731047,2019-06-11,Thompson,"[('Candle Inferno', 1), ('Thunder line', 2), ('Alcon 10', 2)]",11690,79.96,-37.8210304,144.95515749999996,0,11769.96,Winter,True,1.1711,perfect condition better than expected. condition is almost perfect.,True
ORD477636,ID0595868339,2019-12-01,Nickolson,"[('iAssist Line', 1), ('iStream', 2)]",2525,91.05,-37.81194110000001,144.9693608,5,10026.91,Summer,True,0.7409,awesome phone and service phone came faster than i thought it would and works better than i imagined it would,True
ORD066750,ID6167344511,2019-08-29,Nickolson,"[('Candle Inferno', 2), ('Olivia x460', 1), ('Lucent 330S', 2), ('Thunder line', 1)]",6725,79.4,-37.8068471,144.96579430000003,25,5123.15,Winter,True,1.3488,five stars simply awesome,True
ORD151079,ID1449285285,2019-12-21,Bakers,"[('Universe Note', 1), ('Alcon 10', 1), ('Candle Inferno', 1), ('pearTV', 2)]",25450,96.43,-37.8161362,144.98350269999997,15,21728.93,Summer,True,1.4298,"he loves it!!!!! purchased for my husband as a replacement phone he is terrible with them, mechanic so he goes thru phones like crazy. worked perfectly, he's happy so i'm happy.",True
ORD297199,ID6167344366,2019-04-26,Nickolson,"[('Toshika 750', 2), ('Alcon 10', 1)]",17590,64.65,-37.81475379999999,144.968845,10,15895.65,Autumn,False,0.4321,"best xp best xp in the market, and now with call and sms blocking features, this phone, makes any phone wish it didn't exist",False
ORD446596,ID3153810249,2019-03-02,Nickolson,"[('Universe Note', 1), ('iAssist Line', 2)]",7900,66.11,-37.80892470000001,144.96168390000003,5,7571.11,Autumn,True,1.2796,two stars it was not unlocked!,False
ORD037013,ID0506045555,2019-06-08,Thompson,"[('Lucent 330S', 2), ('Olivia x460', 1), ('Toshika 750', 1)]",8005,65.32,-37.8113219,144.93692990000002,25,6069.07,Winter,False,0.9043,para mí todo un gama alta este smartphone me ha permitido deshacerme de la idea de comprar otro.,True
ORD105312,ID2174966072,2019-12-12,Thompson,"[('pearTV', 1), ('Candle Inferno', 1)]",6740,92.99,-37.8170541,144.9533907,10,6158.99,Summer,True,0.7395,smart phone i did a lot of research before purchasing my first smart phone. i am love the big screen and the stylus for me works extremely well. i plan on keeping this phone for some time.,True
ORD149048,ID6167289304,2019-05-27,Nickolson,"[('Lucent 330S', 1), ('Thunder line', 2)]",19130,79.57,-37.8080847,144.96857749999995,5,18253.07,Autumn,True,1.1731,"love this phone. was looking for a phone, not a computer. i love this phone. bought used however had all previous owners contacts still on it. was sold as perfect, not necessarily perfect cosmetically but works great. would recommend seller and phone.",True
ORD338803,ID2181268810,2019-02-04,Thompson,"[('Universe Note', 1), ('Toshika 750', 2), ('Thunder line', 1), ('Alcon 10', 1)]",22265,76.33,-37.8110427,144.9589884,0,22341.33,Summer,False,1.0638,love the line,True
ORD266856,ID4315294434,2019-07-30,Thompson,"[('pearTV', 2), ('iStream', 2), ('Toshika 750', 2)]",21560,62.08,-37.8170456,144.9532158,5,20544.08,Winter,True,0.7274,caller id i have had the over-advertised lucentrola g7 plus for barely a little over 6 weeks and the caller id has failed to function. the screen does not light up during an coming call to display the caller's name and number nor does it display the caller in the call log. i am totally disappointed.,True
ORD180552,ID4754200405,2019-04-21,Thompson,"[('Thunder line', 2), ('Alcon 10', 1), ('Lucent 330S', 1)]",14540,82.61,-37.8165023,144.92828669999997,0,14622.61,Autumn,True,1.7058,"great phone this is a great economy phone! my husband is a licensed irrigator...so, he tends to blow through phones. not this one. the water resistant feature is perfect. also, we're in texas. this phone stays in his pocket. it's crazy hot and his phone is a trooper! no overheating.",True
ORD269235,ID6167236693,2019-01-01,Nickolson,"[('Universe Note', 1), ('pearTV', 1), ('iAssist Line', 1)]",6105,79.68,-37.8123737,144.9623874,0,6184.68,Summer,True,0.9362,alcon xs i orderd a phone for my son and when it came it was not the phone i even ordred it was a different cell phone so i had to return it,False
ORD196710,ID0579494624,2019-10-29,Thompson,"[('Universe Note', 1), ('Candle Inferno', 1), ('Alcon 10', 1), ('Lucent 330S', 2)]",15290,98.54,144.9493105,-37.8144011,0,15388.54,Spring,True,0.2754,i loved my old candle but this new candle is easy to use and has added security that i didn't have with my old candle.,True
ORD195252,ID6197211480,2019-06-15,Thompson,"[('Lucent 330S', 2), ('Thunder line', 2), ('Toshika 750', 2), ('iStream', 2)]",15760,68.09,-37.81399620000001,144.9329345,10,14252.09,Winter,False,1.2517,i took a couple of pictures with the camera and when i went to view them i can't seem to find the pictures. when i bought my tablet they transferred what i had on my 7in but some of the apps didn't transfer. i'll have to come in and have it explained.other than that i am very pleased with it.,True
ORD113812,ID2383211218,2019-07-10,Nickolson,"[('Universe Note', 2), ('Lucent 330S', 2), ('pearTV', 2)]",21980,64.18,-37.81349,144.9656669,5,20945.18,Winter,False,0.663,five stars works perfect,True
ORD367535,ID4716795711,2019-07-09,Bakers,"[('Alcon 10', 2), ('Lucent 330S', 2), ('Thunder line', 1)]",22540,60.73,-37.8192399,144.9529087,5,21473.73,Winter,True,0.8933,total hassle and complete waste of time and resources screen defective; ghost image of a keyboard was burned into the screen. return shipment was not paid by the seller either. total hassle and complete waste of time and resources.,False
ORD440912,ID0356215213,2019-12-10,Nickolson,"[('Toshika 750', 1), ('Lucent 330S', 2), ('Universe Note', 1), ('iStream', 2)]",25970,82.23,-37.8034692,144.9642581,0,26052.23,Summer,False,1.7469,"great it's a very great cellphone, very modern, the pictures are very goog with this camera. muy bueno el telefono en pocas palabras.",True
ORD312542,ID5002594923,2019-12-13,Thompson,"[('Olivia x460', 2), ('pearTV', 2), ('Alcon 10', 1), ('Toshika 750', 2)]",32660,75.53,-37.812314,144.9519583,15,27836.53,Summer,True,0.4318,it has what i wanted click to turn page and that is the only reason i paid that price for it. there is nothing special about it. i thhought that the battery would last longer and as an avid reader it doesn't last long enough.,False
ORD385950,ID0501018995,2019-05-05,Nickolson,"[('Thunder line', 1), ('Universe Note', 2), ('Alcon 10', 1)]",18030,83.01,-37.8049443,144.9733423,5,17211.51,Autumn,False,1.5557,"we originally got the show to video chat family members, and it works great for that. we have found that we really like checking things hands-free like the weather and recipes. so far we have really liked the show, and would recommend it!",True
ORD371056,ID0846591611,11-11-2019,Nickolson,"[('Alcon 10', 1), ('Toshika 750', 1), ('iStream', 2)]",13570,58.64,-37.8220781,144.96950800000005,0,13628.64,Spring,False,0.3877,awful constantly freezing and force closing apps,False
ORD277391,ID0703554589,2019-10-28,Thompson,"[('Olivia x460', 2), ('iStream', 1), ('Alcon 10', 2), ('Lucent 330S', 1)]",21730,77.73,-37.8091964,144.9565147,5,10885.78,Spring,False,0.9164,"overall a good phone had to switch from windows phone eventually, this is a good quality phone at a reasonable price for a smooth transition.",True
ORD071659,ID0107156475,2019-03-08,Nickolson,"[('Candle Inferno', 1), ('Thunder line', 2), ('Olivia x460', 2)]",7240,68.86,-37.8273533,144.9819541,10,6584.86,Autumn,True,1.4629,"great phone, highly recommended! bought this phone for my dad. he loves it. i also have this phone for virgin mobile and it rocks! it has so many more features that my old universe s5.",True
ORD357392,ID0781096056,2019-01-05,Thompson,"[('Thunder line', 1), ('Universe Note', 1), ('iAssist Line', 1)]",7855,61.88,-37.8024434,144.9445601,10,7131.38,Summer,False,1.1599,"frustrated and sadly disappointed was really looking forward to updating my old olivia phone, and i was a little disappointed with how many problems i have been having with this phone. turns off randomly, screen doesn't always turn on, along with other frustrations.",True
ORD495865,ID3215106479,2019-09-14,nickolson,"[('Candle Inferno', 1), ('iAssist Line', 2), ('Lucent 330S', 2), ('iStream', 2)]",7640,83.96,-37.8093528,144.9504044,25,5813.96,Spring,True,0.4719,"it works fine.. just not as advertised this is not a pro. it's a normal ipad. meanwhile, it works fine..just not as advertised.",False
ORD377459,ID2384157684,2019-06-19,Bakers,"[('Olivia x460', 1), ('Universe Note', 1), ('iStream', 1)]",4825,67.02,-37.8007984,145.0054278,15,4168.27,winter,False,1.361,great phone! absolutely love this phone!! love the camera!! amazing!!,True
ORD489094,ID0144730344,2019-12-15,Nickolson,"[('pearTV', 2), ('Thunder line', 1), ('Alcon 10', 1), ('Candle Inferno', 2)]",24610,95.38,144.9583147,-37.8190395,25,18552.88,Summer,True,0.9893,great phone this phone is awesome. it works well and has amazing features. the only downside with buyng a windows phone right now is the app store. not many apps to choose from,True
ORD029426,ID0575552042,2019-05-30,Nickolson,"[('Lucent 330S', 1), ('Candle Inferno', 2), ('Alcon 10', 2), ('pearTV', 1)]",27250,82.49,-37.8263573,144.98599209999998,15,23244.99,Autumn,True,1.6842,buyspry all around a good decision.,True
ORD018992,ID0577356695,2019-11-28,Bakers,"[('Candle Inferno', 1), ('Thunder line', 1), ('Universe Note', 2)]",9510,90.59,144.9902366,-37.8237969,25,7223.09,Spring,True,1.5978,phone doesn't work the internal antenna was broke and would not receive service. had to take it to pear to be looked at only to have to buy a new phone to have a working phone. not worth it.,False
ORD049087,ID0263987223,2019-08-17,Thompson,"[('Thunder line', 1), ('pearTV', 2)]",14800,67.23,-37.8036271,144.95624640000003,15,12647.23,Winter,False,1.2905,you can do some many things and the best part apps for free on digico underground!,True
ORD394857,ID0250480672,2019-02-17,Bakers,"[('Olivia x460', 1), ('pearTV', 1), ('Alcon 10', 2)]",25435,54.22,-37.8093802,145.0025535,10,22945.72,Summer,False,0.6475,"got hoaxed phone doesn't work. i couldn't get it to activate online or over the phone so i took it to the store and they tried for an hour. phone is ""sprint by yemen"". what ever that means. sprint salesman believes its from another country and wont activate here in the united states. wasted my time and money!",True
ORD220992,ID5002594973,2019-06-10,Thompson,"[('Toshika 750', 2), ('iStream', 1), ('iAssist Line', 2), ('pearTV', 1)]",28350,74.58,-37.8118785,144.9522368,10,25589.58,Winter,True,0.463,"phone is nice but seems like i got a used or a returned model phone looks and works fine, no visible wear on it but it seems like its an open box model. the packaging was slightly damaged and the charger and such had visible sings of wear? a little annoying when expecting something new and unused.",True
ORD237723,ID0581783899,2019-11-12,Thompson,"[('Universe Note', 2), ('Thunder line', 1), ('Candle Inferno', 1)]",9510,100.08,144.94197490000005,-37.8086601,25,7232.58,Spring,True,0.6327,good good,True
ORD174521,ID0741702230,2019-04-05,Nickolson,"[('Olivia x460', 2), ('Lucent 330S', 1), ('Thunder line', 1)]",5860,77.94,-37.8174886,144.9676326,10,5351.94,Autumn,True,0.2089,it is fully unlocked..not just unlocked its fully it is a difference.. thanks a bunch it did have just a few scuffs but wasn’t visible unless lookin hard as i do.. overall it great...,True
ORD473590,ID4909776718,2019-12-05,Bakers,"[('Candle Inferno', 1), ('Lucent 330S', 2)]",17895,98.66,-37.8218014,145.0025299,0,2988.66,Summer,True,1.4625,perfect love it,True
ORD341983,ID0575392105,2019-11-12,Nickolson,"[('pearTV', 1), ('Toshika 750', 1)]",10630,105.29,-37.8213689,144.98406630000005,10,9672.29,Spring,True,1.3132,great phone! i just got this phone a couple days ago and i am in love. it works great. texting is a breeze. great size.,True
ORD220037,ID1900213541,2019-07-24,Thompson,"[('iStream', 1), ('Thunder line', 2), ('iAssist Line', 1)]",6735,65.83,-37.8064174,144.9613443,15,5790.58,Winter,False,1.4357,one star no arabic language,False
ORD421349,ID1492153102,2019-12-26,nickolson,"[('iAssist Line', 2), ('Alcon 10', 1), ('Lucent 330S', 2)]",15860,72.05,-37.8124577,144.9538382,15,13553.05,Summer,False,0.5958,"perfect! what's not to like. bt pen is great. camera is great, phone is great. everything is perfect. bixby sucks but hey... that's what google assistant is for.",True
ORD452717,ID0176699701,2019-10-06,Nickolson,"[('Alcon 10', 1), ('Universe Note', 1), ('iStream', 1)]",12550,63.63,-37.8113305,144.9629945,15,10731.13,Autumn,False,0.9932,doesn’t work died on first day,False
ORD044301,ID2325395498,2019-11-01,Thompson,"[('Toshika 750', 1), ('iStream', 1), ('pearTV', 2)]",17090,74.16,144.95291,-37.8115158,25,12891.66,Spring,False,0.5296,good cheap phone good cheap phone,True
ORD409796,ID0031402955,2019-05-28,Nickolson,"[('Candle Inferno', 1), ('Lucent 330S', 2), ('Toshika 750', 2), ('Thunder line', 1)]",13710,85.84,-37.7973464,144.9689413,10,12424.84,Autumn,True,2.3659,nice phone it is good like new,True
ORD356620,ID5402876141,2019-07-21,Nickolson,"[('Olivia x460', 1), ('iStream', 2), ('Candle Inferno', 2)]",2385,64.59,-37.8197781,144.9767491,0,2449.59,Winter,False,0.6465,my olivia s7 edge excellent,True
ORD092719,ID3144850722,2019-03-31,thompson,"[('Lucent 330S', 1), ('iStream', 1)]",1380,80.18,-37.8150465,144.9834342,5,1391.18,Autumn,True,1.1801,olivia a20 everything is perfect,True
ORD197276,ID0777830142,2019-01-27,Thompson,"[('Universe Note', 2), ('Olivia x460', 2)]",9350,99.37,-37.8030248,144.95780019999995,0,9449.37,Summer,True,1.4298,five stars thanks,True
ORD302234,ID0576868846,2019-04-07,Bakers,"[('Thunder line', 1), ('Candle Inferno', 2), ('iAssist Line', 1), ('pearTV', 1)]",11575,68.25,-37.82460800000001,144.99058369999997,15,9907.0,Autumn,False,1.6771,its a good phone! its a good phone!!! but it dosen't work well with metro pcs service. so i will need a refund... what steps do i need to take to get this matter taking care of.. thanks in advance...☺,True
ORD044099,ID0781082267,2019-02-18,Bakers,"[('iStream', 2), ('Thunder line', 2), ('Toshika 750', 1), ('Lucent 330S', 1)]",10210,92.28,-37.8228581,145.0141013,15,8770.78,Spring,True,2.1916,if the phone worked correctly it would have received 5 ... if the phone worked correctly it would have received 5 stars. i got the phone on time. i charged it for 3 hours using multiple chargers only to find out they sent me a phone with a defective charging port.,False
ORD087585,ID4297530201,2019-10-17,Bakers,"[('Toshika 750', 1), ('Universe Note', 2), ('iAssist Line', 1), ('Lucent 330S', 2)]",15905,109.31,-37.8023255,144.9777778,10,14423.81,Spring,True,1.7566,great great phone nice and sturdy box and good shipping,True
ORD166474,ID6167279411,2019-07-14,Nickolson,"[('Toshika 750', 1), ('Thunder line', 1), ('iStream', 2)]",6800,64.78,-37.81024420000001,144.9621553,0,6864.78,Winter,True,1.1345,one star when i receive my phone...the back was broken,True
ORD123101,ID0774529205,2019-01-15,Thompson,"[('Toshika 750', 1), ('Universe Note', 1)]",7770,62.91,-37.8062378,144.95930259999997,0,7832.91,Summer,False,1.2926,very unhappy was not what it was advertised to be,False
ORD441172,ID3148722378,2019-06-20,Nickolson,"[('Alcon 10', 1), ('iStream', 1)]",2330,79.58,-37.82104870000001,144.9579365,5,2293.08,Winter,True,1.0572,great price...great product...thank you! great price...great product...thank you!,True
ORD411110,ID4735909075,2019-06-29,Thompson,"[('Alcon 10', 2), ('Universe Note', 1)]",21350,66.14,-37.8041573,144.9499999,25,16078.64,Winter,False,0.9824,five stars everything ok,True
ORD036396,ID4072557022,2019-01-14,Bakers,"[('Toshika 750', 1), ('iAssist Line', 2), ('Alcon 10', 1)]",17720,71.8,-37.8128953,144.99553600000004,5,16905.8,Summer,True,0.3238,nunca llegó el producto nunca llegó este producto...fue extraviado...y demoraron en avisar... motivo por el cual no pude realizar otra compra,False
ORD491987,ID6245731020,2019-11-27,Nickolson,"[('Alcon 10', 2), ('Toshika 750', 2), ('iAssist Line', 2), ('pearTV', 2)]",43610,87.43,-37.8106616,144.9762036,5,41516.93,Spring,True,1.0593,"phone would not turn on out of box and after full 8hr charge, waste time-dead phone the phone was dead. charged for 8 hrs and the phone was still dead. pressed button according to olivia manual. was a waste of my time. need to know what certified means. obviously the phone was not not tested prior to being sent. horrible quality control.",False
ORD069259,ID2383211218,2019-02-20,Nickolson,"[('pearTV', 1), ('Thunder line', 1)]",7170,72.58,-37.81349,144.9656669,15,7289.08,Summer,False,0.663,overall in very good condition with no obvious signs of previous use bought from dealfisher. phone included a charger. overall in very good condition with no obvious signs of previous use. battery works well and the phone functions as it should. would consider buying from them again.,True
ORD411349,ID0730515880,2019-14-03,Thompson,"[('pearTV', 1), ('iAssist Line', 2), ('Thunder line', 2), ('iStream', 2)]",15420,51.39,-37.8241365,144.9491165,0,15471.39,Autumn,False,1.2887,avoid this phone. as far as how they work it is a decent phone. the problem with it that makes me give it one star is how often something you are doing on the phone is interrupted with pop up ads. to give you an idea while i wrote this review i was interrupted twice. good phone for the money but i would never purchase another.,False
ORD346836,ID0593475946,2019-03-01,Nickolson,"[('Universe Note', 1), ('iAssist Line', 1), ('Lucent 330S', 1), ('Olivia x460', 2)]",9355,81.76,-37.8111216,144.9622215,25,7098.01,Autumn,True,1.0524,"awesome phone great phone, does everything that i ask for my smartphones to do. larger size takes a little getting used to but it makes browsing and email much easier to navigate.",True
ORD266562,ID0780982758,2019-11-22,Thompson,"[('Alcon 10', 2), ('pearTV', 2), ('Thunder line', 2), ('iAssist Line', 1)]",37105,60.1,-37.8050596,144.94934750000004,10,33454.6,Spring,False,0.8709,doesn't work with verizon. does not work with verizon.,False
ORD076260,ID0703556755,2019-12-03,Thompson,"[('iStream', 2), ('Universe Note', 2)]",7200,94.23,144.9560174,-37.8068782,10,6574.23,Summer,True,1.0176,"flagship product at 1/2 price this refurbished olivia universe 7 is great. i have bought 3 of these now. one for myself, one for my wife, now one for my daughter. all of them came in 2 days, were in a great physical/cosmetic and functional condition. will definitely buy again.",True
ORD449471,ID6167359502,2019-03-10,Nickolson,"[('Toshika 750', 1), ('Candle Inferno', 2)]",5180,80.37,-37.8093784,144.9729283,25,3965.37,Autumn,True,1.7545,"good phone.... all good with the phone so far,, just no way to add any extra memory,, 32 gigs . goes fast we diddnt catch that at ztime of ordering,,",True
ORD338256,ID0291211340,2019-06-19,Thompson,"[('Olivia x460', 2), ('iStream', 1), ('Candle Inferno', 1)]",3030,63.62,-37.8088956,144.9608977,15,2639.12,Winter,True,1.2868,"no working anymore . only few days ok awful!!, i was using the alcon for less than 2 months and suddenly blackout during charging !!, no crash no nothing inadmisible!!!!",False
ORD201309,ID6167359488,2019-07-24,Nickolson,"[('pearTV', 2), ('Toshika 750', 2), ('Lucent 330S', 2)]",23720,49.82,-37.81230410000001,144.9736425,0,23769.82,Winter,True,0.7873,"phone doesn't turn on, thanks phone doesn't freaking turn on, i plug in charger sim card battery everything, i connect the phone and it vibrate for a second but there's nothing on screen, very upset with manufacture for sending me a broken phone, will be returning and take business else where",False
ORD081629,ID0634784175,2019-03-02,Thompson,"[('Candle Inferno', 2), ('pearTV', 1), ('Olivia x460', 1), ('Thunder line', 2)]",23435,65.32,-37.816088,144.9393054,15,10907.07,Autumn,False,0.7814,it looks like alcon x it’s amazing,True
ORD253495,ID0452381035,2019-02-24,Thompson,"[('Alcon 10', 1), ('Universe Note', 1), ('iStream', 1)]",12550,79.94,-37.8249498,144.9490132,0,12629.94,Summer,True,1.3772,ok it's ok. however original lucent x is way better simply because its size. same phone...2nd generation is just too big.,True
ORD335835,ID2325395488,2019-10-19,Thompson,"[('Lucent 330S', 1), ('iStream', 1), ('Olivia x460', 1), ('Thunder line', 1)]",4785,81.13,-37.8083042,144.96007959999997,25,3669.88,Spring,False,1.2433,"love it this phone is awesome, i receive it and everything work as described.",True
ORD410077,ID5301568578,2019-04-13,Thompson,"[('Toshika 750', 2), ('Olivia x460', 2), ('iStream', 1), ('Lucent 330S', 1)]",13270,49.63,-37.8087054,144.9422937,15,10649.13,Autumn,False,0.6095,that the phone is not working properly it doesn't have the fast charger and no head phones it keeps glitching,False
ORD046372,ID0282852685,2019-11-16,Bakers,"[('iStream', 1), ('Toshika 750', 2), ('Thunder line', 1), ('Universe Note', 2)]",17870,70.11,-37.7964641,145.0091307,25,13472.61,Spring,True,1.94,"16 gb is really 10gb once you include operating system and bloatware...and no way to get more storage just realized it has no spot for a sd card. i should have read the specs closer but a sd slot is assumed to be present on any phone, especially one with a tiny 16gb hard drive.",False
ORD278446,ID2400284473,2019-05-31,Nickolson,"[('Alcon 10', 1), ('iAssist Line', 2), ('Thunder line', 1)]",15580,47.92,-37.8198106,144.96503080000005,0,15627.92,Autumn,True,0.4199,"defective product. the phone doesn't work, and it is being returned.",False
ORD040394,ID0248746699,2019-07-14,Bakers,"[('iAssist Line', 2), ('Lucent 330S', 2), ('Thunder line', 2), ('Olivia x460', 2)]",13720,47.27,-37.8117158,144.99209419999997,5,13081.27,Winter,False,0.3359,network my phone would not connect to the network and it was a verison network and screwed around with it for 2 hours. never doing that again.,False
ORD433893,ID0250774462,2019-04-28,Bakers,"[('Lucent 330S', 2), ('Toshika 750', 2), ('Thunder line', 1)]",13280,69.64,145.01226699999995,-37.8153615,5,12685.64,Autumn,False,1.6128,super easy set up and am loving our new thunder!,True
ORD085553,ID3106294940,2019-08-23,Thompson,"[('Toshika 750', 2), ('Candle Inferno', 2)]",9500,68.06,-37.8062405,144.93197980000005,10,8618.06,Winter,False,1.5079,amazing perfect! quality of the thousand dollar phones for way less.,True
ORD173015,ID4655129063,2019-04-09,Thompson,"[('Alcon 10', 2), ('pearTV', 2), ('iStream', 1), ('iAssist Line', 1)]",32895,62.35,-37.8095308,144.9478195,10,29667.85,Autumn,False,0.356,will buy again excellent,True
ORD214725,ID0332797060,2019-11-06,Bakers,"[('iStream', 1), ('iAssist Line', 1), ('Candle Inferno', 2)]",3235,72.38,-37.8085998,145.00047659999996,10,2983.88,Spring,False,0.4867,great phone! very happy with my purchase,True
